Event,Start Date,Start Time,End Date,End Time,Location,Category,Description
Men's Track and Field  Mountain T's Invitational,2/2/18,10:00 AM,2/2/18,11:59 PM,"Flagstaff, AZ",Men's Track and Field,"Men's Track and Field  Mountain T's Invitational Flagstaff, AZ"
Women's Track and Field  Mountain T's Invitational,2/2/18,10:00 AM,2/2/18,11:59 PM,"Flagstaff, AZ",Women's Track and Field,"Women's Track and Field  Mountain T's Invitational Flagstaff, AZ"
Men's Tennis at  UNLV,2/2/18,2:00 PM,2/2/18,5:00 PM,"Las Vegas, NV",Men's Tennis,"Men's Tennis at  UNLV Las Vegas, NV"
Women's Tennis vs  Cal State Fullerton,2/3/18,11AM,2/3/18,2:00 PM,"Riverside, CA",Women's Tennis,"Women's Tennis vs  Cal State Fullerton Riverside, CA"
Women's Basketball at  Cal Poly,2/3/18,2:00 PM,2/3/18,5:00 PM,"San Luis Obispo, CA",Women's Basketball,"Women's Basketball at  Cal Poly San Luis Obispo, CA"
Men's Tennis vs  Weber State University,2/3/18,10:00 AM,2/3/18,1:00 PM,"Las Vegas, NV",Men's Tennis,"Men's Tennis vs  Weber State University Las Vegas, NV"
Men's Tennis vs  New Mexico State University,2/3/18,2:00 PM,2/3/18,5:00 PM,"Las Vegas, NV",Men's Tennis,"Men's Tennis vs  New Mexico State University Las Vegas, NV"
Men's Basketball at  Hawai'i,2/7/18,9:00 PM,2/7/18,11:59 PM,"Manoa, HI",Men's Basketball,"Men's Basketball at  Hawai'i Manoa, HI"
General vs  Coaches' Show,2/7/18,6-7 pm,2/7/18,3:00 AM,Lake Alice Trading Company,General,General vs  Coaches' Show Lake Alice Trading Company
Women's Basketball vs  UC Santa Barbara,2/8/18,7:00 PM,2/8/18,10:00 PM,"Riverside, CA",Women's Basketball,"Women's Basketball vs  UC Santa Barbara Riverside, CA"
Women's Track and Field  UW Husky Classic ,2/9/18,10:00 AM,2/9/18,11:59 PM,"Seattle, WA",Women's Track and Field,"Women's Track and Field  UW Husky Classic  Seattle, WA"
Men's Track and Field  UW Husky Classic ,2/9/18,10:00 AM,2/9/18,11:59 PM,"Seattle, WA",Men's Track and Field,"Men's Track and Field  UW Husky Classic  Seattle, WA"
Softball vs  Rutgers,2/9/18,1:00 PM,2/9/18,4:00 PM,"Fullerton, CA",Softball,"Softball vs  Rutgers Fullerton, CA"
Softball vs  Loyola Marymount,2/9/18,3:30 PM,2/9/18,6:30 PM,"Fullerton, CA",Softball,"Softball vs  Loyola Marymount Fullerton, CA"
Men's Track and Field  UNM Don Kirby Invitational ,2/9/18,4:00 PM,2/9/18,11:59 PM,"Albuquerque, NM",Men's Track and Field,"Men's Track and Field  UNM Don Kirby Invitational  Albuquerque, NM"
Women's Track and Field  UNM Don Kirby Invitational ,2/9/18,4:00 PM,2/9/18,11:59 PM,"Albuquerque, NM",Women's Track and Field,"Women's Track and Field  UNM Don Kirby Invitational  Albuquerque, NM"
Women's Tennis vs  Colorado State University,2/10/18,10:00 AM,2/10/18,1:00 PM,"Las Vegas, NV",Women's Tennis,"Women's Tennis vs  Colorado State University Las Vegas, NV"
Women's Basketball at  UC Irvine,2/10/18,2:00 PM,2/10/18,5:00 PM,"Irvine, CA",Women's Basketball,"Women's Basketball at  UC Irvine Irvine, CA"
Women's Tennis at  UNLV,2/10/18,2:00 PM,2/10/18,5:00 PM,"Las Vegas, NV",Women's Tennis,"Women's Tennis at  UNLV Las Vegas, NV"
Softball vs  Maryland,2/10/18,2:30 PM,2/10/18,5:30 PM,"Los Angeles, CA",Softball,"Softball vs  Maryland Los Angeles, CA"
Men's Basketball vs  UC Irvine,2/10/18,5:00 PM,2/10/18,8:00 PM,,Men's Basketball,Men's Basketball vs  UC Irvine 
Men's Tennis vs  Biola University,2/10/18,10:00 AM,2/10/18,1:00 PM,Student Recreation Center,Men's Tennis,Men's Tennis vs  Biola University Student Recreation Center
Women's Tennis vs  Youngstown State University,2/11/18,10:00 AM,2/11/18,1:00 PM,"Las Vegas, NV",Women's Tennis,"Women's Tennis vs  Youngstown State University Las Vegas, NV"
Softball vs  Middle Tennessee,2/11/18,11:30 AM,2/11/18,2:30 PM,"Los Angeles, CA",Softball,"Softball vs  Middle Tennessee Los Angeles, CA"
Softball vs  UCLA,2/11/18,4:30 PM,2/11/18,7:30 PM,"Los Angeles, CA",Softball,"Softball vs  UCLA Los Angeles, CA"
Men's Golf  University of San Diego,2/12/18, PM,2/12/18,11:59 PM,"San Diego, CA",Men's Golf,"Men's Golf  University of San Diego San Diego, CA"
Women's Golf  Battle at the Rock ,2/12/18, PM,2/12/18,11:59 PM,"Riverside, CA",Women's Golf,"Women's Golf  Battle at the Rock  Riverside, CA"
Softball vs  San Diego State,2/14/18,1:00 PM,2/14/18,4:00 PM,,Softball,Softball vs  San Diego State 
Men's Basketball at  CSUN,2/14/18,7:00 PM,2/14/18,10:00 PM,"Northridge, CA",Men's Basketball,"Men's Basketball at  CSUN Northridge, CA"
Women's Basketball vs  CSUN,2/15/18,7:00 PM,2/15/18,10:00 PM,"Riverside, CA",Women's Basketball,"Women's Basketball vs  CSUN Riverside, CA"
Baseball vs  Washington State,2/16/18,11:00 AM,2/16/18,2:00 PM,"Tempe, AZ",Baseball,"Baseball vs  Washington State Tempe, AZ"
Baseball vs  Nebraska,2/16/18,3:00 PM,2/16/18,6:00 PM,"Tempe, AZ",Baseball,"Baseball vs  Nebraska Tempe, AZ"
Men's Golf  Wyoming Desert Intercollegiate,2/16/18, PM,2/17/18,11:59 PM,"Palm Desert, CA",Men's Golf,"Men's Golf  Wyoming Desert Intercollegiate Palm Desert, CA"
Softball vs  Army,2/17/18,10:00 AM,2/17/18,1:00 PM,"Cathedral City, CA",Softball,"Softball vs  Army Cathedral City, CA"
Baseball vs  Nebraska,2/17/18,3:00 PM,2/17/18,6:00 PM,"Tempe, AZ",Baseball,"Baseball vs  Nebraska Tempe, AZ"
Men's Basketball vs  Hawai'i,2/17/18,7:30 PM,2/17/18,10:30 PM,,Men's Basketball,Men's Basketball vs  Hawai'i 
Softball vs  Stanford,2/18/18,9:30 AM,2/18/18,12:30 PM,"Cathedral City, CA",Softball,"Softball vs  Stanford Cathedral City, CA"
Softball vs  Grand Canyon,2/18/18,12:00 PM,2/18/18,3:00 PM,"Cathedral City, CA",Softball,"Softball vs  Grand Canyon Cathedral City, CA"
Baseball vs  Washington State,2/18/18,3:00 PM,2/18/18,6:00 PM,"Tempe, AZ",Baseball,"Baseball vs  Washington State Tempe, AZ"
Softball vs  Sacramento State,2/19/18,9:00 AM,2/19/18,12:00 PM,"Cathedral City, CA",Softball,"Softball vs  Sacramento State Cathedral City, CA"
Softball vs  California,2/19/18,1:30 PM,2/19/18,4:30 PM,"Cathedral City, CA",Softball,"Softball vs  California Cathedral City, CA"
Men's Basketball vs  Cal State Fullerton,2/21/18,7:00 PM,2/21/18,10:00 PM,,Men's Basketball,Men's Basketball vs  Cal State Fullerton 
Women's Tennis vs  Nevada,2/22/18,1:30PM,2/22/18,4:30 PM,"Riverside, CA",Women's Tennis,"Women's Tennis vs  Nevada Riverside, CA"
Women's Basketball at  Cal State Fullerton,2/22/18,7:00 PM,2/22/18,10:00 PM,"Fullerton, CA",Women's Basketball,"Women's Basketball at  Cal State Fullerton Fullerton, CA"
Softball vs  New Mexico,2/23/18,2:00 PM,2/23/18,5:00 PM,"Riverside, CA",Softball,"Softball vs  New Mexico Riverside, CA"
Women's Track and Field  MPSF Indoor Championship,2/23/18,4:00 PM,2/23/18,11:59 PM,"Seattle, WA",Women's Track and Field,"Women's Track and Field  MPSF Indoor Championship Seattle, WA"
Men's Track and Field  MPSF Indoor Championship,2/23/18,4:00 PM,2/23/18,11:59 PM,"Seattle, WA",Men's Track and Field,"Men's Track and Field  MPSF Indoor Championship Seattle, WA"
Baseball at  Washington,2/23/18,6:05 PM,2/23/18,9:05 PM,"Seattle, WA",Baseball,"Baseball at  Washington Seattle, WA"
Baseball at  Washington,2/24/18,1:05 PM,2/24/18,4:05 PM,"Seattle, WA",Baseball,"Baseball at  Washington Seattle, WA"
Women's Tennis at  UC Santa Barbara,2/24/18,2PM,2/24/18,5:00 PM,"Santa Barbara, CA",Women's Tennis,"Women's Tennis at  UC Santa Barbara Santa Barbara, CA"
Softball vs  George Washington,2/24/18,2:00 PM,2/24/18,5:00 PM,"Riverside, CA",Softball,"Softball vs  George Washington Riverside, CA"
Men's Tennis vs  Richmond,2/24/18,3:00 PM,2/24/18,6:00 PM,"Colorado Springs, CO",Men's Tennis,"Men's Tennis vs  Richmond Colorado Springs, CO"
Women's Basketball at  UC Santa Barbara,2/24/18,4:00 PM,2/24/18,7:00 PM,"Santa Barbara, CA",Women's Basketball,"Women's Basketball at  UC Santa Barbara Santa Barbara, CA"
Baseball at  Washington,2/24/18,4:35 PM,2/24/18,7:35 PM,"Seattle, WA",Baseball,"Baseball at  Washington Seattle, WA"
Men's Basketball at  UC Davis,2/24/18,5:00 PM,2/24/18,8:00 PM,"Davis, CA",Men's Basketball,"Men's Basketball at  UC Davis Davis, CA"
Softball vs  Montana,2/25/18,11:30 AM,2/25/18,2:30 PM,"Riverside, CA",Softball,"Softball vs  Montana Riverside, CA"
Baseball at  Washington,2/25/18,12:05 PM,2/25/18,3:05 PM,"Seattle, WA",Baseball,"Baseball at  Washington Seattle, WA"
Softball vs  New Mexico,2/25/18,2:00 PM,2/25/18,5:00 PM,"Riverside, CA",Softball,"Softball vs  New Mexico Riverside, CA"
Men's Tennis at  Air Force Academy,2/25/18,9:00 AM,2/25/18,5:00 PM,"Colorado Springs, CO",Men's Tennis,"Men's Tennis at  Air Force Academy Colorado Springs, CO"
Men's Tennis at  Colorado State- Pueblo,2/25/18,2:30 PM,2/25/18,5:30 PM,"Pueblo, CO",Men's Tennis,"Men's Tennis at  Colorado State- Pueblo Pueblo, CO"
Softball vs  Saint John's,2/27/18,11:00 AM,2/27/18,2:00 PM,,Softball,Softball vs  Saint John's 
Softball vs  Saint John's,2/27/18,1:30 PM,2/27/18,4:30 PM,,Softball,Softball vs  Saint John's 
Baseball vs  UNLV,2/27/18,3:00 PM,2/27/18,6:00 PM,"Riverside, CA",Baseball,"Baseball vs  UNLV Riverside, CA"
Men's Basketball vs  Cal Poly,3/1/18,7:00 PM,3/1/18,10:00 PM,,Men's Basketball,Men's Basketball vs  Cal Poly 
Women's Basketball at  Long Beach State,3/1/18,7:00 PM,3/1/18,10:00 PM,"Long Beach, CA",Women's Basketball,"Women's Basketball at  Long Beach State Long Beach, CA"
Softball vs  Saint Mary's,3/2/18,2:00 PM,3/2/18,5:00 PM,"Riverside, CA",Softball,"Softball vs  Saint Mary's Riverside, CA"
Women's Track and Field  RCC/Cal State Fullerton,3/3/18,11:00 AM,3/3/18,2:00 PM,"Riverside, CA",Women's Track and Field,"Women's Track and Field  RCC/Cal State Fullerton Riverside, CA"
Men's Track and Field  RCC/Cal State Fullerton,3/3/18,11:00 AM,3/3/18,2:00 PM,"Riverside, CA",Men's Track and Field,"Men's Track and Field  RCC/Cal State Fullerton Riverside, CA"
Softball vs  Stony Brook,3/3/18,2:00 PM,3/3/18,5:00 PM,"Riverside, CA",Softball,"Softball vs  Stony Brook Riverside, CA"
Baseball vs  San Francisco,3/3/18,2:00 PM,3/3/18,5:00 PM,"Riverside, CA",Baseball,"Baseball vs  San Francisco Riverside, CA"
Women's Basketball vs  UC Davis,3/3/18,4:00 PM,3/3/18,7:00 PM,"Riverside, CA",Women's Basketball,"Women's Basketball vs  UC Davis Riverside, CA"
Men's Basketball at  Long Beach State,3/3/18,7:30 PM,3/3/18,10:30 PM,"Long Beach, CA",Men's Basketball,"Men's Basketball at  Long Beach State Long Beach, CA"
Softball vs  Brown,3/4/18,11:30 AM,3/4/18,2:30 PM,"Riverside, CA",Softball,"Softball vs  Brown Riverside, CA"
Baseball vs  San Francisco,3/4/18,12:00 PM,3/4/18,3:00 PM,"Riverside, CA",Baseball,"Baseball vs  San Francisco Riverside, CA"
Softball vs  Saint Mary's,3/4/18,2:00 PM,3/4/18,5:00 PM,"Riverside, CA",Softball,"Softball vs  Saint Mary's Riverside, CA"
Baseball vs  San Francisco,3/4/18,3:30 PM,3/4/18,6:30 PM,"Riverside, CA",Baseball,"Baseball vs  San Francisco Riverside, CA"
Men's Tennis vs  Southern Utah,3/4/18,9:30 AM,3/4/18,12:30 PM,Student Recreation Center,Men's Tennis,Men's Tennis vs  Southern Utah Student Recreation Center
Men's Tennis vs  Northern Arizona,3/4/18,2:00 PM,3/4/18,5:00 PM,Student Recreation Center,Men's Tennis,Men's Tennis vs  Northern Arizona Student Recreation Center
Women's Tennis vs  Villanova,3/5/18,1:30 PM,3/5/18,4:30 PM,"Riverside, CA",Women's Tennis,"Women's Tennis vs  Villanova Riverside, CA"
General vs  Coaches' Show,3/5/18,6-7 pm,3/5/18,3:00 AM,Lake Alice Trading Company,General,General vs  Coaches' Show Lake Alice Trading Company
Women's Golf  Fresno State Classic,3/5/18, PM,3/5/18,11:59 PM,"Fresno, CA",Women's Golf,"Women's Golf  Fresno State Classic Fresno, CA"
Baseball vs  Valparaiso ,3/6/18,6:00 PM,3/6/18,9:00 PM,"Riverside, CA",Baseball,"Baseball vs  Valparaiso  Riverside, CA"
Women's Basketball vs  No. 7 Long Beach State,3/6/18,8:30 PM,3/6/18,11:30 PM,"Fullerton, CA",Women's Basketball,"Women's Basketball vs  No. 7 Long Beach State Fullerton, CA"
Men's Tennis vs  Youngstown State,3/6/18,2:00 PM,3/6/18,5:00 PM,Student Recreation Center,Men's Tennis,Men's Tennis vs  Youngstown State Student Recreation Center
Women's Tennis vs  Toledo,3/7/18,1:30PM,3/7/18,4:30 PM,"Riverside, CA",Women's Tennis,"Women's Tennis vs  Toledo Riverside, CA"
Women's Basketball vs  No. 3 UC Irvine,3/7/18,6:00 PM,3/7/18,9:00 PM,"Fullerton, CA",Women's Basketball,"Women's Basketball vs  No. 3 UC Irvine Fullerton, CA"
Baseball vs  Valparaiso,3/7/18,6:00 PM,3/7/18,9:00 PM,"Riverside, CA",Baseball,"Baseball vs  Valparaiso Riverside, CA"
Men's Tennis vs  Boston University,3/7/18,9:00 AM,3/7/18,12:00 PM,Student Recreation Center,Men's Tennis,Men's Tennis vs  Boston University Student Recreation Center
Men's Basketball vs  No. 1 UC Davis,3/8/18,12:00 PM,3/8/18,3:00 PM,"Anaheim, CA",Men's Basketball,"Men's Basketball vs  No. 1 UC Davis Anaheim, CA"
Softball vs  Boise State,3/8/18,12:00 PM,3/8/18,3:00 PM,,Softball,Softball vs  Boise State 
Women's Tennis vs  Utah State,3/8/18,1:30PM,3/8/18,4:30 PM,"Riverside, CA",Women's Tennis,"Women's Tennis vs  Utah State Riverside, CA"
Softball vs  Boise State,3/8/18,2:30 PM,3/8/18,5:30 PM,,Softball,Softball vs  Boise State 
Women's Track and Field  NCAA Indoor Championships,3/9/18,9:00 AM,3/9/18,11:59 PM,"College Station, TX",Women's Track and Field,"Women's Track and Field  NCAA Indoor Championships College Station, TX"
Men's Track and Field  NCAA Indoor Championships,3/9/18,9:00 AM,3/9/18,11:59 PM,"College Station, TX",Men's Track and Field,"Men's Track and Field  NCAA Indoor Championships College Station, TX"
Women's Basketball vs  UC Davis,3/9/18,12:00 PM,3/9/18,3:00 PM,"Anaheim, CA",Women's Basketball,"Women's Basketball vs  UC Davis Anaheim, CA"
Softball vs  North Dakota State,3/9/18,2:00 PM,3/9/18,5:00 PM,"Riverside, CA",Softball,"Softball vs  North Dakota State Riverside, CA"
Baseball vs  Utah,3/9/18,6:00 PM,3/9/18,9:00 PM,"Riverside, CA",Baseball,"Baseball vs  Utah Riverside, CA"
Men's Tennis vs  Villanova,3/9/18,2:00 PM,3/9/18,5:00 PM,Student Recreation Center,Men's Tennis,Men's Tennis vs  Villanova Student Recreation Center
Women's Track and Field  UC Santa Barbara/Cal Poly,3/10/18,12:00 PM,3/10/18,3:00 PM,"Santa Barbara, CA",Women's Track and Field,"Women's Track and Field  UC Santa Barbara/Cal Poly Santa Barbara, CA"
Men's Track and Field  UC Santa Barbara/Cal Poly,3/10/18,12:00 PM,3/10/18,3:00 PM,"Santa Barbara, CA",Men's Track and Field,"Men's Track and Field  UC Santa Barbara/Cal Poly Santa Barbara, CA"
Softball vs  Columbia,3/10/18,2:00 PM,3/10/18,5:00 PM,"Riverside, CA",Softball,"Softball vs  Columbia Riverside, CA"
Men's Tennis vs  Azusa Pacific,3/10/18,2:00 PM,3/10/18,5:00 PM,Student Recreation Center,Men's Tennis,Men's Tennis vs  Azusa Pacific Student Recreation Center
Baseball vs  Utah,3/11/18,12:00 PM,3/11/18,3:00 PM,"Riverside, CA",Baseball,"Baseball vs  Utah Riverside, CA"
Softball vs  Colgate,3/11/18,2:00 PM,3/11/18,5:00 PM,"Riverside, CA",Softball,"Softball vs  Colgate Riverside, CA"
Baseball vs  Utah,3/11/18,3:00 PM,3/11/18,6:00 PM,"Riverside, CA",Baseball,"Baseball vs  Utah Riverside, CA"
Women's Tennis vs  UC Davis,3/11/18,3PM,3/11/18,6:00 PM,"Riverside, CA",Women's Tennis,"Women's Tennis vs  UC Davis Riverside, CA"
Men's Tennis vs  Bucknell,3/12/18,9:30 AM,3/12/18,12:30 PM,Student Recreation Center,Men's Tennis,Men's Tennis vs  Bucknell Student Recreation Center
Men's Tennis vs  Concordia Irvine,3/12/18,2:00 PM,3/12/18,5:00 PM,Student Recreation Center,Men's Tennis,Men's Tennis vs  Concordia Irvine Student Recreation Center
Softball vs  Harvard,3/13/18,12:30 PM,3/13/18,3:30 PM,"Riverside, CA",Softball,"Softball vs  Harvard Riverside, CA"
Women's Tennis vs  Southern Utah,3/13/18,1:30PM,3/13/18,4:30 PM,"Riverside, CA",Women's Tennis,"Women's Tennis vs  Southern Utah Riverside, CA"
Softball vs  Colgate,3/13/18,3:00 PM,3/13/18,6:00 PM,"Riverside, CA",Softball,"Softball vs  Colgate Riverside, CA"
Women's Tennis vs  Bradley,3/14/18,1:30PM,3/14/18,4:30 PM,"Riverside, CA",Women's Tennis,"Women's Tennis vs  Bradley Riverside, CA"
Baseball vs  Grand Canyon ,3/14/18,6:00 PM,3/14/18,9:00 PM,"Riverside, CA",Baseball,"Baseball vs  Grand Canyon  Riverside, CA"
Softball vs  Idaho State vs. Texas Tech,3/16/18,9:00 AM,3/16/18,12:00 PM,,Softball,Softball vs  Idaho State vs. Texas Tech 
Softball vs  Purdue vs. Texas Tech,3/16/18,11:30 AM,3/16/18,2:30 PM,,Softball,Softball vs  Purdue vs. Texas Tech 
Women's Tennis vs  Drake,3/16/18,1:30PM,3/16/18,4:30 PM,"Riverside, CA",Women's Tennis,"Women's Tennis vs  Drake Riverside, CA"
Softball vs  Purdue,3/16/18,2:00 PM,3/16/18,5:00 PM,"Riverside, CA",Softball,"Softball vs  Purdue Riverside, CA"
Baseball at  Nevada,3/16/18,3:00 PM,3/16/18,6:00 PM,"Reno, NV",Baseball,"Baseball at  Nevada Reno, NV"
Men's Golf  Grand Canyon University,3/16/18, PM,3/16/18,11:59 PM,"Phoenix, AZ",Men's Golf,"Men's Golf  Grand Canyon University Phoenix, AZ"
Softball vs  Idaho State vs. Purdue,3/17/18,9:00 AM,3/17/18,12:00 PM,,Softball,Softball vs  Idaho State vs. Purdue 
Softball vs  Idaho State vs. Texas Tech,3/17/18,11:30 AM,3/17/18,2:30 PM,,Softball,Softball vs  Idaho State vs. Texas Tech 
Baseball at  Nevada,3/17/18,12:00 PM,3/17/18,3:00 PM,"Reno, NV",Baseball,"Baseball at  Nevada Reno, NV"
Softball vs  Purdue vs. Texas Tech,3/17/18,2:00 PM,3/17/18,5:00 PM,,Softball,Softball vs  Purdue vs. Texas Tech 
Baseball at  Nevada,3/17/18,3:00 PM,3/17/18,6:00 PM,"Reno, NV",Baseball,"Baseball at  Nevada Reno, NV"
Softball vs  Idaho State vs. Purdue,3/18/18,9:00 AM,3/18/18,12:00 PM,,Softball,Softball vs  Idaho State vs. Purdue 
Softball vs  Texas Tech ,3/18/18,11:30 AM,3/18/18,2:30 PM,"Riverside, CA",Softball,"Softball vs  Texas Tech  Riverside, CA"
Baseball at  Nevada,3/18/18,12:00 PM,3/18/18,3:00 PM,"Reno, NV",Baseball,"Baseball at  Nevada Reno, NV"
Softball vs  Idaho State,3/18/18,2:00 PM,3/18/18,5:00 PM,"Riverside, CA",Softball,"Softball vs  Idaho State Riverside, CA"
Men's Tennis vs  Charleston College,3/18/18,10:00 AM,3/18/18,1:00 PM,Student Recreation Center,Men's Tennis,Men's Tennis vs  Charleston College Student Recreation Center
Women's Track and Field  UC Riverside Spring Track Classic (Multis),3/22/18,11:00 AM,3/22/18,11:59 PM,"Riverside, CA",Women's Track and Field,"Women's Track and Field  UC Riverside Spring Track Classic (Multis) Riverside, CA"
Men's Track and Field  UC Riverside Spring Track Classic (Multis),3/22/18,11:00 AM,3/22/18,11:59 PM,"Riverside, CA",Men's Track and Field,"Men's Track and Field  UC Riverside Spring Track Classic (Multis) Riverside, CA"
Men's Track and Field  UC Riverside Spring Track Classic,3/24/18,10:00 AM,3/24/18,1:00 PM,"Riverside, CA",Men's Track and Field,"Men's Track and Field  UC Riverside Spring Track Classic Riverside, CA"
Women's Track and Field  UC Riverside Spring Track Classic,3/24/18,10:00 AM,3/24/18,1:00 PM,"Riverside, CA",Women's Track and Field,"Women's Track and Field  UC Riverside Spring Track Classic Riverside, CA"
Softball vs  San Diego,3/24/18,1:00 PM,3/24/18,4:00 PM,"Riverside, CA",Softball,"Softball vs  San Diego Riverside, CA"
Softball vs  San Diego,3/24/18,3:30 PM,3/24/18,6:30 PM,"Riverside, CA",Softball,"Softball vs  San Diego Riverside, CA"
Softball vs  San Diego,3/25/18,1:00 PM,3/25/18,4:00 PM,"Riverside, CA",Softball,"Softball vs  San Diego Riverside, CA"
Women's Golf  Anuenue Spring Break Classic,3/26/18, PM,3/27/18,11:59 PM,"Maui, HI",Women's Golf,"Women's Golf  Anuenue Spring Break Classic Maui, HI"
Men's Tennis at  North Carolina A&T,3/26/18,9:00 AM,3/26/18,12:00 PM,"Greensboro, NC",Men's Tennis,"Men's Tennis at  North Carolina A&T Greensboro, NC"
Men's Tennis at  Campbell,3/26/18,1:30 PM,3/26/18,4:30 PM,"Buies Creek, NC",Men's Tennis,"Men's Tennis at  Campbell Buies Creek, NC"
Baseball at  Fresno State,3/27/18,6:05 PM,3/27/18,9:05 PM,"Fresno, CA",Baseball,"Baseball at  Fresno State Fresno, CA"
Men's Tennis at  Methodist,3/27/18,6:00 AM,3/27/18,9:00 AM,"Fayette, MO",Men's Tennis,"Men's Tennis at  Methodist Fayette, MO"
Men's Tennis at  Chowan,3/27/18,12:00 PM,3/27/18,3:00 PM,"Murfreesboro, NC",Men's Tennis,"Men's Tennis at  Chowan Murfreesboro, NC"
Men's Tennis at  West Virginia Wesleyan,3/28/18,6:30 AM,3/28/18,9:30 AM,"Buckhannon, WV",Men's Tennis,"Men's Tennis at  West Virginia Wesleyan Buckhannon, WV"
Men's Tennis at  Norfolk State,3/28/18,12:00 PM,3/28/18,3:00 PM,"Norfolk, VA",Men's Tennis,"Men's Tennis at  Norfolk State Norfolk, VA"
Baseball vs  UC Davis,3/29/18,6:00 PM,3/29/18,9:00 PM,"Riverside, CA",Baseball,"Baseball vs  UC Davis Riverside, CA"
Men's Track and Field  Stanford Invitational,3/30/18,8:00 AM,3/30/18,11:59 PM,"Stanford, CA",Men's Track and Field,"Men's Track and Field  Stanford Invitational Stanford, CA"
Women's Track and Field  Stanford Invitational,3/30/18,8:00 AM,3/30/18,11:59 PM,"Stanford, CA",Women's Track and Field,"Women's Track and Field  Stanford Invitational Stanford, CA"
Softball at  Cal Poly,3/30/18,1:00 PM,3/30/18,4:00 PM,"San Luis Obispo, CA",Softball,"Softball at  Cal Poly San Luis Obispo, CA"
Baseball vs  UC Davis,3/30/18,6:00 PM,3/30/18,9:00 PM,"Riverside, CA",Baseball,"Baseball vs  UC Davis Riverside, CA"
Men's Tennis at  North Carolina Central,3/30/18,12:00 PM,3/30/18,3:00 PM,"Durham, NC",Men's Tennis,"Men's Tennis at  North Carolina Central Durham, NC"
Men's Track and Field  Sacramento State Mondo Team Challenge,3/31/18,11:00 AM,3/31/18,2:00 PM,"Sacramento, CA",Men's Track and Field,"Men's Track and Field  Sacramento State Mondo Team Challenge Sacramento, CA"
Women's Track and Field  Sacramento State Mondo Team Challenge,3/31/18,11:00 AM,3/31/18,2:00 PM,"Sacramento, CA",Women's Track and Field,"Women's Track and Field  Sacramento State Mondo Team Challenge Sacramento, CA"
Softball at  Cal Poly,3/31/18,1:00 PM,3/31/18,4:00 PM,"San Luis Obispo, CA",Softball,"Softball at  Cal Poly San Luis Obispo, CA"
Baseball vs  UC Davis,3/31/18,1:00 PM,3/31/18,4:00 PM,"Riverside, CA",Baseball,"Baseball vs  UC Davis Riverside, CA"
Softball at  Cal Poly,3/31/18,3:30 PM,3/31/18,6:30 PM,"San Luis Obispo, CA",Softball,"Softball at  Cal Poly San Luis Obispo, CA"
Men's Tennis vs  Cal Poly,4/1/18,2:00 PM,4/1/18,5:00 PM,Student Recreation Center,Men's Tennis,Men's Tennis vs  Cal Poly Student Recreation Center
General vs  Coaches' Show,4/4/18,6-7 pm,4/4/18,3:00 AM,Lake Alice Trading Company,General,General vs  Coaches' Show Lake Alice Trading Company
Women's Tennis vs  Westmont College (Calif.),4/4/18,1:30 PM,4/4/18,4:30 PM,Student Recreation Center,Women's Tennis,Women's Tennis vs  Westmont College (Calif.) Student Recreation Center
Baseball vs  CSUN,4/6/18,6:00 PM,4/6/18,9:00 PM,"Riverside, CA",Baseball,"Baseball vs  CSUN Riverside, CA"
Men's Track and Field  Pomona-Pitzer Invitational,4/7/18,9:00 AM,4/7/18,12:00 PM,"Claremont, CA",Men's Track and Field,"Men's Track and Field  Pomona-Pitzer Invitational Claremont, CA"
Women's Track and Field  Pomona-Pitzer Invitational,4/7/18,9:00 AM,4/7/18,12:00 PM,"Claremont, CA",Women's Track and Field,"Women's Track and Field  Pomona-Pitzer Invitational Claremont, CA"
Women's Tennis at  CSUN,4/7/18,11AM,4/7/18,2:00 PM,"Northridge, CA",Women's Tennis,"Women's Tennis at  CSUN Northridge, CA"
Softball at  Long Beach State,4/7/18,1:00 PM,4/7/18,4:00 PM,"Long Beach, CA",Softball,"Softball at  Long Beach State Long Beach, CA"
Softball at  Long Beach State,4/7/18,3:30 PM,4/7/18,6:30 PM,"Long Beach, CA",Softball,"Softball at  Long Beach State Long Beach, CA"
Baseball vs  CSUN,4/7/18,6:00 PM,4/7/18,9:00 PM,"Riverside, CA",Baseball,"Baseball vs  CSUN Riverside, CA"
Women's Tennis at  Cal Poly,4/8/18,11AM,4/8/18,2:00 PM,"San Luis Obispo, CA",Women's Tennis,"Women's Tennis at  Cal Poly San Luis Obispo, CA"
Softball at  Long Beach State,4/8/18,1:00 PM,4/8/18,4:00 PM,"Long Beach, CA",Softball,"Softball at  Long Beach State Long Beach, CA"
Baseball vs  CSUN,4/8/18,1:00 PM,4/8/18,4:00 PM,"Riverside, CA",Baseball,"Baseball vs  CSUN Riverside, CA"
Men's Tennis at  Pepperdine,4/8/18,TBD PM,4/8/18,3:00 AM,"Malibu, CA",Men's Tennis,"Men's Tennis at  Pepperdine Malibu, CA"
Women's Golf  Bobcat Desert Invitational,4/9/18, PM,4/9/18,11:59 PM,"Goodyear, AZ",Women's Golf,"Women's Golf  Bobcat Desert Invitational Goodyear, AZ"
Baseball vs  San Diego,4/10/18,6:00 PM,4/10/18,9:00 PM,"Riverside, CA",Baseball,"Baseball vs  San Diego Riverside, CA"
Men's Track and Field  Highlander Challenge,4/13/18,2:00 PM,4/13/18,5:00 PM,"Riverside, CA",Men's Track and Field,"Men's Track and Field  Highlander Challenge Riverside, CA"
Women's Tennis at  Chaminade,4/13/18,2PM,4/13/18,5:00 PM,"Honolulu, HI",Women's Tennis,"Women's Tennis at  Chaminade Honolulu, HI"
Women's Track and Field  Highlander Challenge,4/13/18,2:00 PM,4/13/18,5:00 PM,"Riverside, CA",Women's Track and Field,"Women's Track and Field  Highlander Challenge Riverside, CA"
Baseball at  Hawai'i,4/13/18,9:35 PM,4/14/18,12:35 AM,"Manoa, HI",Baseball,"Baseball at  Hawai'i Manoa, HI"
Men's Tennis at  UC Irvine,4/13/18,1:00 PM,4/13/18,4:00 PM,"Irvine, CA",Men's Tennis,"Men's Tennis at  UC Irvine Irvine, CA"
Softball vs  CSUN,4/14/18,1:00 PM,4/14/18,4:00 PM,"Riverside, CA",Softball,"Softball vs  CSUN Riverside, CA"
Women's Tennis at  Hawai'i,4/14/18,2PM,4/14/18,5:00 PM,"Honolulu, HI",Women's Tennis,"Women's Tennis at  Hawai'i Honolulu, HI"
Softball vs  CSUN,4/14/18,3:30 PM,4/14/18,6:30 PM,"Riverside, CA",Softball,"Softball vs  CSUN Riverside, CA"
Baseball at  Hawai'i,4/14/18,9:35 PM,4/15/18,12:35 AM,"Manoa, HI",Baseball,"Baseball at  Hawai'i Manoa, HI"
Softball vs  CSUN,4/15/18,1:00 PM,4/15/18,4:00 PM,"Riverside, CA",Softball,"Softball vs  CSUN Riverside, CA"
Baseball at  Hawai'i,4/15/18,4:05 PM,4/15/18,7:05 PM,"Manoa, HI",Baseball,"Baseball at  Hawai'i Manoa, HI"
Women's Golf  Big West Championship,4/15/18, PM,4/16/18,11:59 PM,"Irvine, CA",Women's Golf,"Women's Golf  Big West Championship Irvine, CA"
Men's Tennis vs  UC Santa Barbara,4/15/18,12:00 PM,4/15/18,3:00 PM,Student Recreation Center,Men's Tennis,Men's Tennis vs  UC Santa Barbara Student Recreation Center
